key,en,pl
monster_evelius_smalltalk_1_1,"Don't you have some adventurers to kill, slave?","Nie masz jakichś poszukiwaczy przygód do zabicia, sługo?"
monster_evelius_smalltalk_2_1,"Good day, fellow slave.","Dzień dobry, towarzyszu niewoli."
monster_evelius_smalltalk_3_1,"Hey, do something useful and kill some adventurers for me.","Hej, zrób coś pożytecznego i zabij dla mnie kilku poszukiwaczy przygód."
monster_evelius_smalltalk_4_1,"Hey, get back to work.","Hej, wracaj do roboty."
monster_evelius_smalltalk_5_1,I don't pay you to just wonder around the tower. Go and guard some doors!,Nie płacę ci za snucie się po wieży. Idź pilnować jakichś drzwi!
monster_evelius_smalltalk_6_1,Have you seen any adventurers? I'm waiting on my next victim. Hehehe.,Widziałeś jakichś poszukiwaczy przygód? Czekam na moją następną ofiarę. Hehehe.
